item_name,full_price,new_price,discount,amount_saved
sunsilk conditioner long & strong,Was $7.99,$ 3 99,Save $4.00,50.06
sunsilk shampoo long & strong,Was $7.99,$ 3 99,Save $4.00,50.06
kelloggs sultana bran cereal original,Was $11.00,$ 6 00,Save $5.00,45.45
countdown NZ beef rump steak 1-2 pack grass fed,Was $27.50,$ 15 00 kg,Save $12.50,45.45
ecostore dishwash liquid grapefruit,Was $5.00,$ 3 20,Save $1.80,36.0
pepsi max soft drink cola max,Was $3.50,$ 2 30,Save $1.20,34.29
moccona café classics coffee sachets caramel latte,Was $7.50,$ 5 00,Save $2.50,33.33
schweppes drink mixers indian tonic water,Was $4.20,$ 2 80,Save $1.40,33.33
coca cola soft drink zero sugar,Was $13.00,$ 9 00,Save $4.00,30.77
sprite lemon lime no sugar,Was $13.00,$ 9 00,Save $4.00,30.77
eta uppercuts deli cut potato chips sea salt & balsamic vinegar,Was $3.60,$ 2 50,Save $1.10,30.56
colgate cavity protection toothpaste great regular flavour,Was $4.99,$ 3 50,Save $1.49,29.86
fresh n fruity yoghurt tub fruit forest 40% less added,Was $6.80,$ 4 80,Save $2.00,29.41
mainland special reserve double cream brie cheese ultra creamy & smooth,Was $6.90,$ 4 90,Save $2.00,28.99
tip top ice cream jelly tip,Was $8.30,$ 5 90,Save $2.40,28.92
tip top ice cream boysenberry ripple,Was $8.30,$ 5 90,Save $2.40,28.92
tip top ice cream chocolate,Was $8.30,$ 5 90,Save $2.40,28.92
tip top ice cream caramel ripple,Was $8.30,$ 5 90,Save $2.40,28.92
tip top ice cream orange chocolate chip,Was $8.30,$ 5 90,Save $2.40,28.92
meadow fresh yoghurt 6pk creamy berries 6 x 125g,Was $6.90,$ 5 00,Save $1.90,27.54
meadow fresh smooth yoghurt 6pk fruit favourites 6 x 125g,Was $6.90,$ 5 00,Save $1.90,27.54
the natural confectionery co jelly sweets party mix,Was $4.00,$ 2 90,Save $1.10,27.5
the natural confectionery co jelly sweets snakes,Was $4.00,$ 2 90,Save $1.10,27.5
ajax spray n wipe multipurpose cleaning spray vanilla & berries,Was $5.50,$ 4 00,Save $1.50,27.27
ajax spray n wipe cleaning kitchen spray multipurpose baking soda,Was $5.50,$ 4 00,Save $1.50,27.27
just hummus hummus beetroot with roasted garlic,Was $4.10,$ 3 00,Save $1.10,26.83
just hummus hummus roasted carrot & honey,Was $4.10,$ 3 00,Save $1.10,26.83
just hummus hummus roasted kumara & butternut,Was $4.10,$ 3 00,Save $1.10,26.83
san remo pasta spaghetti egg,Was $3.40,$ 2 50,Save $0.90,26.47
copper kettle potato chips honey soy chicken,Was $4.70,$ 3 50,Save $1.20,25.53
active rapid dishwasher tablets lemon,Was $14.70,$ 11 00,Save $3.70,25.17
sun rice long grain rice premium white,Was $4.00,$ 3 00,Save $1.00,25.0
fantastic instant noodles cup chicken,Was $2.00,$ 1 50,Save $0.50,25.0
hellers streaky bacon,Was $12.50,$ 9 50,Save $3.00,24.0
oreo creme filled original 230g,Was $4.30,$ 3 30,Save $1.00,23.26
dilmah black tea bags tagless,Was $6.50,$ 5 00,Save $1.50,23.08
instore bakery bread rolls plain crusty,Was $3.90,$ 3 00,Save $0.90,23.08
"tip top popsicle ice blocks lime, orange & raspberry minis",Was $8.30,$ 6 40,Save $1.90,22.89
tip top popsicle ice blocks lemonade minis,Was $8.30,$ 6 40,Save $1.90,22.89
colgate advanced whitening toothpaste tartar control,Was $5.79,$ 4 50,Save $1.29,22.28
uncle tobys rolled oats,Was $7.70,$ 6 00,Save $1.70,22.08
mainland edam cheese mild & creamy,Was $7.50,$ 5 90,Save $1.60,21.33
sorbent facial tissues silky white,Was $3.79,$ 3 00,Save $0.79,20.84
tararua dip creamy onion,Was $4.80,$ 3 80,Save $1.00,20.83
castello blue cheese creamy blue,Was $10.70,$ 8 50,Save $2.20,20.56
verkerks salami sliced dutch (mild),Was $5.00,$ 3 99,Save $1.01,20.2
proper crisps potato chips marlborough sea salt,Was $5.00,$ 4 00,Save $1.00,20.0
coca cola soft drink zero sugar,Was $15.00,$ 12 00,Save $3.00,20.0
mutti tomato paste double concentrate,Was $2.50,$ 2 00,Save $0.50,20.0
kelloggs froot loops cereal,Was $7.40,$ 6 00,Save $1.40,18.92
sealord fish fingers classic crumbed hoki 400g,Was $8.00,$ 6 50,Save $1.50,18.75
anchor cheese slices processed tasty,Was $4.90,$ 4 00,Save $0.90,18.37
countdown NZ corned beef silverside grass fed,Was $14.30,$ 11 90 kg,Save $2.40,16.78
watties pasta sauce tomato & herb,Was $3.00,$ 2 50,Save $0.50,16.67
anathoth farm raspberry jam,Was $6.00,$ 5 00,Save $1.00,16.67
countdown free farmed bone in pork shoulder roast NZ,Was $13.00,$ 10 90 kg,Save $2.10,16.15
meadow fresh sour cream lite,Was $2.60,$ 2 20,Save $0.40,15.38
mainland butter unsalted,Was $8.50,$ 7 20,Save $1.30,15.29
wattie's condensed soup tomato canned,Was $3.30,$ 2 80,Save $0.50,15.15
countdown chicken whole,Was $17.50,$ 15 00,Save $2.50,14.29
mccain super fries straight cut,Was $5.00,$ 4 30,Save $0.70,14.0
highmark soy sauce golden,Was $4.30,$ 3 70,Save $0.60,13.95
whittakers chocolate block 50% cocoa dark,Was $6.50,$ 5 60,Save $0.90,13.85
whittakers chocolate block 72% cocoa dark ghana,Was $6.50,$ 5 60,Save $0.90,13.85
watties shoestring golden fries,Was $5.20,$ 4 50,Save $0.70,13.46
active dishwasher powder lemon,Was $12.70,$ 11 00,Save $1.70,13.39
griffins cookie bear chocolate chip biscuits chocolate chippies,Was $5.50,$ 4 80,Save $0.70,12.73
leanne's kitchen dumplings pork & cabbage,Was $4.00,$ 3 50,Save $0.50,12.5
mother earth oaty slices muesli bars afghan 240g,Was $4.00,$ 3 50,Save $0.50,12.5
arnotts crackers sesame wheat,Was $3.99,$ 3 50,Save $0.49,12.28
arnotts crackers country cheese,Was $3.99,$ 3 50,Save $0.49,12.28
countdown NZ chicken thigh cutlets skinless bone in,Was $16.50,$ 14 50 kg,Save $2.00,12.12
tararua spread supersoft original,Was $6.80,$ 6 00,Save $0.80,11.76
charlies orange juice,Was $8.90,$ 7 90,Save $1.00,11.24
orchard gold frozen blueberries supreme,Was $9.00,$ 8 00,Save $1.00,11.11
olivani spread lite,Was $11.00,$ 9 80,Save $1.20,10.91
tony's crumbed lasagne toppa,Was $18.50,$ 16 50,Save $2.00,10.81
meadow fresh sour cream lite,Was $4.70,$ 4 20,Save $0.50,10.64
hellers sausages precooked chunky cheese,Was $13.90,$ 12 50,Save $1.40,10.07
fantastic 2 minute instant noodles multi pack chicken,Was $5.00,$ 4 50,Save $0.50,10.0
instore bakery baps,Was $4.00,$ 3 60,Save $0.40,10.0
sanitarium up & go breakfast drink choc ice,Was $10.90,$ 9 90,Save $1.00,9.17
harvest snaps pea snaps original salted,Was $5.50,$ 5 00,Save $0.50,9.09
chelsea white sugar,Was $2.20,$ 2 00,Save $0.20,9.09
watties salsa chilli beans medium,Was $3.50,$ 3 20,Save $0.30,8.57
oxo vegetable stock cubes 71g,Was $3.60,$ 3 30,Save $0.30,8.33
mainland edam cheese mild & creamy,Was $13.90,$ 12 80,Save $1.10,7.91
glad plastic wrap cling,Was $2.59,$ 2 39,Save $0.20,7.72
pascall family pack marshmallows vanilla & raspberry,Was $6.50,$ 6 00,Save $0.50,7.69
instore bakery baguette,Was $3.00,$ 2 80,Save $0.20,6.67
meadow fresh uht milk standard long life,Was $3.00,$ 2 80,Save $0.20,6.67
tegel free range chicken burgers crunchy,Was $15.50,$ 14 50,Save $1.00,6.45
tegel free range chicken tenders panko bread crumbs,Was $15.50,$ 14 50,Save $1.00,6.45
big black sacks rubbish bags drawstring extra large,Was $3.19,$ 2 99,Save $0.20,6.27
best foods mayonnaise lite,Was $6.90,$ 6 50,Save $0.40,5.8
the collective greek probiotic yoghurt tub unsweetened,Was $9.00,$ 8 70,Save $0.30,3.33
anchor sour cream original,Was $4.40,$ 4 30,Save $0.10,2.27
